{
  "name": "5_make_production_ready",
  "summary": "Revisit setup decisions made loosely for local dev convenience and harden them before any real deployment.",
  "description": "Several early decisions (mostly from docker_setup) were made for local-dev simplicity and are explicitly not production-grade: a dev-only backend server, hardcoded DB credentials, dev toolchains baked into images, ports exposed directly with no reverse proxy/TLS, a Windows-dev-only Docker workaround, and a directory layout that hasn't been stress-tested at scale. This goal collects each of those loose ends as a task, to be revisited once the app is functionally complete and deployment becomes a real concern. Done when each task has been reviewed and either hardened or explicitly deferred with a note why.",
  "status": "completed",
  "created": "2026-07-06",
  "completed_at": "2026-10-04",
  "key_decisions": [
    {
      "decision": "Closed without doing its tasks (2026-10-04): superseded by desktop_application. The six tasks are left as todo on purpose - they all harden a Docker/web deployment that is being replaced.",
      "rationale": "User's real aim with this goal was an application that doesn't require starting Docker containers and exporting the database before shutting them down. The desktop application, storing data in readable files with no containers, delivers that directly, so hardening the container setup no longer serves any purpose."
    }
  ]
}
